定式ID,匹配步数,落子前缀
kj_24322,18,pd tt nc re rd qd qe qc rc pe qf pc od rf rb qg pf mc
kj_09611,10,pc qe od qh tt lc qd pe qj nc
kj_84211,7,pc qe nd qc qb pb rb
kj_60340,10,pc qe tt od oc nd mc tt md qh
kj_93103,8,pc tt pe qg tt oc od nc
kj_20696,7,pd tt nc tt qg md kc
kj_40294,17,pd qc pc qd qf qe pe rf tt qg pf qb tt pg tt ng mf
kj_59569,9,pd nc tt qc qd pc od mb me
kj_62294,11,pd nc qf tt lc pc qc qb rc od pb
kj_23300,8,pc tt pe qg qi og oi qd
kj_69715,7,pd tt nc rd qd re rc
kj_50184,25,pc qe qh od pd pe oe oc ob md pf pb qb qc pa qd pb rb mc of ne nd ld me nf
kj_77726,12,pd qc pc qd qf rf qg rg qh tt qe re
kj_82401,10,pd qc pc qd pe qe pf qf qg tt
kj_61474,8,pc pe qe qf qd pf nc pj
kj_49260,17,pc qe tt od oc nd mc tt md me le mf lf mg lg mh qd
kj_59050,14,pd qc pc qd qe re rf qf pe rg rd sf rc pf
kj_67878,13,pd nc qf pc qc qb oc pb od ob nd mc md
kj_56833,12,pc pe qe qf re rf pf oe pg qh ph qi
kj_57673,7,pc qe ph od oc nd mb
kj_93206,19,pd pc oc qc od re qf qe pf ob nb pb tt pe oe of ph og qi
kj_34545,8,pc qe nd lc tt me pf qg
kj_14613,8,pc qe od tt pf tt qg kd
kj_75203,10,pd tt nc md tt nd mc lc od kd
kj_59746,7,pd tt nc tt qh qf tt
kj_96497,6,pc tt pf qh ql tt
kj_72613,23,pc tt pe pf qf qg pg of og qe rf nf re qd pd rg rd ng oi tt nh tt lh
kj_59102,20,pd nc lc tt nd od oe oc md pc qc qd pe rc qb rb rf re mc pb
kj_76788,17,pc tt qf pd qd oc pe od pb oe of nf ob og pf ni tt
kj_30151,10,pc pe qe qf qd pf nc tt me tt
kj_72074,9,pd tt mc ld lc kd tt md nc
kj_87133,7,pd nc oc nd pf tt mg
kj_79865,15,pd nc nd md ne ob pb pc qc oc qb me mf lf mg
kj_61177,14,pd qc pc qd qf qe pe rf tt qg pf qb pb le
kj_69600,9,pd qc pc qd pe rf kc qg tt
kj_29927,9,pc tt pe qi tt oc od nc pb
kj_53938,13,pd qc pc qd qf qe pe rf qg rg qh le kd
kj_97023,9,pc qe tt od oc nd mc pi tt
kj_97947,8,pc qe qh od oc nd mb tt
kj_13764,6,pd nc qf ne tt kd
kj_44407,24,pd qc pc qd qf qe pe rf qb rb re pb rc qa rd qb rg pf qg nc nf ld jc kc
kj_66730,16,pd qc pc qd qf qe pe rf tt qg pf pb ob qb nc tt
kj_79649,9,pc pe qe qf qd pf nc pj mf
kj_94822,8,pd qc pc qd pe qe pf qf
kj_71404,28,pd qc pc qd qf rf rg qe pf pe oe od ob nd ne me of rb mc md lc kd qb sf sb rc ra rh
kj_81155,6,pd qc pc qd pe rf
kj_16775,13,pc qe qg od pd pe oe of ne pg ph oh pi
kj_20614,12,pc qe qg od pd pe oe of ne pg md pi
kj_58836,6,pc tt qe tt kc kd
kj_64195,9,pc qe qh od oc nd mc tt oh
kj_58636,6,pd tt nc md mc tt
kj_55242,6,pc qe od qh tt of
kj_65113,17,pc qe tt od oc nd mc tt md me le lf mf ne ke kf mg
kj_37556,17,pc tt qf pd qd oc pb od pe oe of nf og ng oh qc qb
kj_87221,17,pd qc pc qd qf qe pe rf qb rb re pf qg rd of rg qh
kj_12221,14,pd qc pc qd qf qe pe rf qg rg qh tt ke of
kj_35515,8,pc qe qd pe nc pi tt ol
kj_15310,10,pd nc kd pf of qc pc qd pe qe
kj_24403,8,pc qe nd lc qh pg qd pe
kj_50348,12,pd nc qf tt lc ld kd ke kc md tt pg
kj_97234,10,pd qc pc qd qf qe pe rf tt kd
kj_11098,9,pd nc nd qc qd pc oc ob od
kj_71652,9,pd qc pc qd pe rf tt ld ic
kj_18659,16,pd nc lc qc pc qd pe pb ob qb nb qf tt kd ld ke
kj_66337,7,pc qe od pf tt ne lc
kj_08075,6,pc tt qf tt ni tt
kj_68141,9,pd qc pc qd pe rf tt kg tt
kj_26321,9,pd nc lc jc tt ne pg je pc
kj_81155,6,pd qc pc qd pe rf
kj_62785,22,pd qc pc qd qf qe pe rf qb rb re pb rc qa rd qb rg pf qg nc nf kd
kj_25619,11,pd nc oc nd tt qf pf pg of qe pe
kj_44039,10,pd qc pc qd qf rf qg rg qh ql
kj_87882,16,pd nc tt qf pf pg of re qc kc md mc pi og ng nh
kj_82635,15,pd tt ld qc pc qd qe re rf qf pe rg rd sf rc
kj_79925,9,pd qc pc qd pe rf tt lc kf
kj_39627,31,pd qc pc qd qf rf rg qe pf pe oe od ob nd ne me of qb md nc mc nb mb na le mf kg lh lf mg qj
kj_82825,11,pc qe nd tt kd qc qb pb ob pd pa
kj_98232,8,pc tt pe qg qf pg nf nh
kj_65151,10,pd qc pc qd qf rf qg rg qh ld
kj_33776,8,pc qe qd od oc nd re nc
kj_71378,8,pc qe od tt pf qg tt nc
kj_21744,13,pc qe tt od oc nd mc md lc ld qd re tt
kj_08455,10,pc qe od tt qh pf nf rc oh qb
kj_56026,7,pc qe tt od qd re nb
kj_72582,6,pd tt nc qi qf oi
kj_02470,29,pd qc pc qd qf rf rg qe pf pe oe od ob nd ne me mf mc le md qb re kc qg nf pg lb lf ke
kj_79634,11,pd qc pc qd pe qf tt rg tt lc ic
kj_02972,10,pc pe qe qf qd pf tt oc ob pd
kj_47474,6,pd tt nc tt qg pg
kj_31164,15,pd qc pc qd qf qe pf pe oe pb ob qb nc of ne
kj_96483,12,pd qc pc qd qf qe pe rf tt qg pf qb
kj_45423,7,pc qe qd pe nd tt of
kj_28250,24,pd qc pc qd qf rf rg qe pf pe oe of ne pb ob qb mc nf re me nd oc od rd
kj_97525,6,pc tt pf tt lc pd
kj_29754,9,pc qe qi od oc nd mb qk qg
kj_78751,8,pd qc pc qd pe rf qf rg
kj_66933,17,pc tt pe pf of qe oe qd pg pd od qc qf oc nc pb ob
kj_87757,10,pd nc nd md ne pc qc oc qd qg
kj_53303,6,pc pe qe qf qd pg
kj_04711,14,pd qc pc qd qf qe pe rf qg rg qh tt ke kd
kj_89954,11,pd qc pc qd pe rf tt ld tt qg ng
kj_30108,6,pd nc oc nd qf kc
kj_48318,23,pd qc pc qd pe qe qf rf tt pf qg rg of pg qh ph qi pi pj qj qk rj oj
kj_67473,10,pc pe qe qf qd pf nc pj tt jc
kj_84713,6,pc qe od tt qh pk
kj_97776,16,pd qc pc qd qf qe pe rf tt qg pf qb tt pg ld jc
kj_92493,7,pc tt qe pf qf ph tt
kj_37681,7,pc tt pe tt qh kc tt
kj_29184,7,pc tt qf kc mc tt le
kj_58697,7,pc qe nd pi qd pe oi
kj_97664,9,pd qc pc qd qf rf pe rg lc
kj_44304,8,pc tt pe qg qi pi ph qh
kj_28744,7,pd tt mc qf qe pf tt
kj_21615,13,pd nc qf pc qc qb oc pb od ob tt qh tt
kj_12110,12,pd qc pc qd pe rf tt ld qf qg qb rh
kj_90367,11,pc qe qg od pd pe oe of ne pg md
kj_03198,11,pd qc pc qd pe rf tt nc ld kd nd
kj_91543,8,pc qe od qh tt nc nd md
kj_78487,6,pd nc pf pj qj pi
kj_03097,16,pd qc pc qd pe rf qg qf pf pg qh ph pi oi pj oj
kj_41235,14,pd qc pc qd qf qe pe rf qg rg qh kd ke le
kj_34705,16,pd tt nc re qe rd qg qd pe pc oc pb rf tt rb rc
kj_39743,12,pc qe od tt qh pf oh nf ld rc id tt
kj_83970,10,pd qc pc qd pe rf qf rg ph qb
kj_12438,6,pc tt pe kd tt nc
kj_61889,14,pd qc pc qd qf qe pe rf qg rg qh tt ke kf
kj_72166,8,pc qe od qh tt kc pf qf
kj_59383,7,pd nc pf tt oc nd tt
kj_72626,14,pd qc pc qd pe qe qf rf tt qg pf qb tt ld
kj_59990,12,pc qe nd lc tt qc qb rc pf qf pg rh
kj_44153,8,pd nc lc qf pf pg of og
kj_26156,8,pc tt qe pf qf oc pd qj
kj_09562,14,pd nc qf tt lc pc qc qb rc od pb oc rb og
kj_61266,8,pd nc pf tt oc tt nd rf
kj_32783,8,pd tt nc md mc kd tt gd
kj_65955,6,pd tt nc mc nd md
kj_76181,13,pd qc pc qd qf qe pe rf qg rg qh le tt
kj_89633,13,pd nc lc qc pc qd pe pb ob qb nb qf ic
kj_64348,12,pd qc pc qd qf rf pe rg tt qb tt ph
kj_28656,6,pc tt pe pf qf tt
kj_33569,8,pc qe od tt qh qj pf qc
kj_57566,7,pd nc lc id tt ne pg
kj_77716,16,pd qc pc qd qe re rf qf pe rg rd sf rc tt og qj
kj_17649,13,pd nc qf pc qc qb oc pb od ob rc nd tt
kj_55217,6,pc qe od qh tt ql
kj_48186,6,pc tt pf kc tt qh
kj_39385,15,pd qc pc qd qf rf qg rg qh tt qe re pb qb tt
kj_17639,9,pd tt nc re qf rf qd qe qh
kj_44957,8,pd nc qg tt nd md ne pc
kj_32049,6,pc qe nd tt qi me
kj_10290,10,pc qe qd pe nd tt ph og oh mg
kj_65972,6,pc qe od lc tt nc
kj_86071,6,pc qe od qh tt oi
kj_84474,16,pd qc pc qd qf qe pe rf qb qg pf rh rc rd sd re
kj_72970,8,pd nc lc tt qc pg of tt
kj_30261,6,pc qe od lc tt hc
kj_15959,30,pd qc pc qd qf qe pe rf qb rb re pb rc qa rd qb rg pf qg oe of pg ne nc od ph qi lc nh tt
kj_31276,10,pc tt pe pf qe oc nd pb qc lc
kj_61701,10,pd nc lc ne pg jc jd id kd hd
kj_48831,6,pc qe nd jd kd id
kj_98192,13,pd qc pc qd qf qe pe rf qg rg qh of qb
kj_36916,12,pd qc pc qd pe rf qg qf pf pb ob qb
kj_88908,9,pc qe tt od oc nd mc le qg
kj_62632,13,pd qc pc qd qf rf qg rg qh lc tt qe pe
kj_44174,7,pc qe od tt pf qg lc
kj_58046,7,pd tt nc qf tt rd qc
kj_84654,6,pc qe od qh tt le
kj_89550,12,pc qe tt od oc nd mc tt md me le lf
kj_66776,10,pc qe tt od oc nd mc qi pi ph
kj_45914,9,pc qe pi od oc nd mc tt md
kj_54224,7,pd pc oc qc od re pg
kj_47925,9,pd pc qc oc qd lc jc ne je
kj_54618,9,pc pe qe qf qd pf nc tt qi
kj_25194,8,pc pe qe qf qd pf nd mf
kj_64194,7,pd tt nc md nd mf ph
kj_83397,6,pd tt mc ld md lf
kj_39434,39,pd qc pc qd qf rf rg qe pf pe oe od ob nd ne me mf mc qb re le md qh rb ra rc mb lb nb lf mg kc sd sb sf se sg ma na
kj_48972,10,pc qe nd tt pf qc qb qd ob qg
kj_51036,7,pd tt nc qg qi rd qd
kj_67209,14,pd qc pc qd qf qe pe rf tt qg pf qb ld pg
kj_48296,13,pd qc pc qd pe rf tt qg tt ld pg lf ph
kj_83906,8,pd nc qf tt oc tt nd tt
kj_39970,6,pd tt nc jc tt re
kj_89943,10,pd qc pc qd qf qe pe rf lc tt
kj_98446,9,pc tt qe pf tt qf pe of pj
kj_43203,16,pd qc pc qd qf qe pe rf qb rb re rd rg se pg ld
kj_92645,15,pd tt nc qf tt qd qc rc qe rd re pc pe oc nd
kj_04354,8,pd nc oc nd qf qc nb re
kj_65344,25,pd qc pc qd qf qe pe rf qb rb re pb rc qa rd qb rg pf qg nc of tt mc md nb
kj_01663,28,pd qc pc qd qf qe pe rf qb rb re pb rc qa rd qb rg pf qg nc nf ld tt of oe ph nd ng
kj_92647,8,pc pe qe qf qd pf nc qj
kj_98932,8,pd tt nc qf qe pf pi me
kj_68867,7,pc qe qd pe nc pi tt
kj_53456,6,pd nc jc hc oc nd
kj_55393,6,pc qe qd pe nc qh
kj_27212,15,pc qe tt nd pe pd od qd oc oe pf qc nc of pg
kj_01548,12,pc qe od tt qh pf rd nf md pi og qi
kj_19458,10,pd nc pf oe pe pb tt ph tt qc
kj_87308,14,pc tt pe oc od nc pb nd ne me nf mf mg qg
kj_71352,12,pd qc pc qd qf rf qg rg qh qe pe ld
kj_67961,7,pd nc oc nd pf qh kc
kj_62393,12,pc pe tt oc ob od nc nb mb pb na qc
kj_84818,10,pc qe tt od oc nd nc md mc ld
kj_85845,9,pc qe tt od oc nd mc qi tt
kj_50010,8,pc qe tt od oc nd nc md
kj_92665,24,pd qc pc qd pe qe qf rf tt ld qg rg qh of qb rb rc rd sb sc ra sa sb sa
kj_32863,11,pc pe qe qf qd pf nc qj tt pd qc
kj_55867,7,pd nc qf tt oc nd kc
kj_72656,9,pd tt nc tt qi tt oi qf qe
kj_79002,8,pd nc qf tt kd pc qc qb
kj_52454,8,pc qe od qh tt lc jc nc
kj_23097,6,pc qe nd tt qg ri
kj_74791,13,pd nc qf tt lc ld kd kc ke lb tt mc kb
kj_95960,10,pd nc lc jc nd qc qd pc od nb
kj_66931,8,pd qc pc qd pe rf tt le
kj_65446,7,pd qc pc qd pe rf qi
kj_62950,15,pc tt qf pd oc qc qd qe rd re pe od rc nc qb
kj_11639,13,pd qc pc qd pe rf qg qf pf pb ob qb tt
kj_71829,11,pd qc pc qd pe rf tt ld tt ic tt
kj_57123,7,pd tt nc re qd qh qf
kj_58729,11,pc tt pe pf qf qg qe oc od nc pb
kj_57212,9,pc qe qi od oc nd mc qk qg
kj_58958,14,pd qc pc qd pe rf qg pb ob qb nc qf pf pg
kj_56279,14,pd qc pc qd qf qe pe rf tt qg pf qb pg qh
kj_80105,7,pc qe nd tt ph qh qg
kj_64861,6,pc tt pe oc od nc
kj_76234,14,pd nc tt qc pc qd pe pb ob qb oc qf tt ne
kj_50709,13,pd qc pc qd qf qe pe rf qg rg qh lc tt
kj_29927,9,pc tt pe qi tt oc od nc pb
kj_37512,8,pd qc pc qd pe rf qg ke
kj_70986,13,pd tt nc qf tt qd qc rc rb rd pc pi qk
kj_27702,10,pc qe nd lc tt le pf pe of qf
kj_51562,7,pc qe nd tt qh tt pk
kj_47130,23,pd qc pc qd qf qe pe rf qb rb re rd rg pf sf pb pg of nc tt og nf ng
kj_77384,13,pd qc pc qd qf qe pe rf qg rg qh tt ql
kj_56040,8,pc tt qe pf qf oc pd kc
kj_68652,22,pc tt qf pd od qc qd pe qe oc pb nd oe pf nc qg ob pg rg rh rf qi
kj_45679,13,pc qe nd tt qi qc qb rb qd rc pd rd rf
kj_28253,17,pd nc oc nd pf jd lb lc kc qc qd ob pc ld mb nb jc
kj_22444,10,pd nc tt qc qd pc od mb ph tt
kj_97395,7,pc tt qf tt mc ld tt
kj_56497,17,pc qe qh od pd pe oe oc ob mc md ne of ld me nf og
kj_74206,9,pc qe tt od oc nd mc tt ph
kj_76757,8,pd nc nd oc od pc qd qc
kj_71776,7,pd nc tt qc qd pc od
kj_51953,10,pd nc lc qc pc qd pe rf tt qg
kj_63166,10,pd nc lc tt ic pf of og nf ng
kj_74759,6,pc tt qe pf qf ph
kj_11106,22,pc pe qe qf qd pf nc pj tt qm rh pd qc qh qi pi qg ph rf pg rg tt
kj_67848,7,pd nc pf oe pe pb qc
kj_35918,6,pd nc pf jc tt qh
kj_09854,6,pc tt pe pb oc ob
kj_54762,15,pd qc pc qd qf qe pe rf qb rb re rd rg se qg
kj_11154,11,pc qe qh od oc nd mb oh pj tt ld
kj_32550,8,pd tt nc qf qe pf pi ne
kj_86071,6,pc qe od qh tt oi
kj_67431,14,pd tt nc qf tt qd qc rc qe rd pe re og pc
kj_17558,10,pc tt pf qh qj oh tt pd od qc
kj_87054,10,pd nc qf pc qc qb rb pb qd kd
kj_01736,8,pc qe nd pi qh qi ph ri
kj_09630,23,pd qc pc qd qf qe pe rf qb rb re rd rg pf qg of ob qa pa pb qb tt ra
kj_44652,19,pd qc pc qd qf qe pe rf qb rb re rd rg tt sf pb ob qa tt
kj_03475,8,pc qe od tt qh pf lc rc
kj_81185,7,pc tt pf kc kd tt lc
kj_77802,6,pc qe nd tt og qg
kj_36752,6,pd tt nc md jd tt
kj_36752,6,pd tt nc md jd tt
kj_90647,10,pc qe tt od oc nd mc tt pi qi
kj_95743,8,pc qe od tt qh pf rd og
kj_71696,8,pd qc pc qd pe rf tt qg
kj_03305,7,pc qe od qh kc tt kd
kj_62047,12,pd qc pc qd pe rf tt lc tt le tt hc
kj_29086,11,pd qc pc qd pe qf tt rg og tt lc
kj_04354,8,pd nc oc nd qf qc nb re
kj_44304,8,pc tt pe qg qi pi ph qh
kj_76536,16,pd qc pc qd qf qe pe rf tt kc qg rg qh ke tt of
kj_64588,10,pd qc pc qd pe rf tt nc qb rb
kj_40634,19,pc tt pe pf qf qg pg of qh rg qe ph og qi oh rh nf oi ni
kj_40264,9,pd nc lc qf nd qc pc qd pe
kj_57935,7,pc qe nd tt qi ql tt
kj_63709,12,pd nc tt qf nd md ne pc qc oc qd ph
kj_04894,12,pd qc pc qd pe rf tt qg ld kd ke je
kj_63535,10,pd qc pc qd pe rf qf rg tt oi
kj_67481,11,pd qc pc qd qf qe pe rf qg rg qh
kj_93271,7,pd nc oc nd pf jc lc
kj_52335,18,pd qc pc qd qf qe pe rf qb rb rg pb ob qg pf rh pa sg
kj_80998,8,pc qe qi od oc nd mb tt
kj_67660,8,pc qe od qh qj tt qd pe
kj_22461,7,pc tt pe pf qe nf of
kj_45679,13,pc qe nd tt qi qc qb rb qd rc pd rd rf
kj_06523,7,pd nc qf tt kc hc id
kj_38484,7,pc tt pf tt qh pi qi
kj_86559,8,pc qe od lc pf qf pg qh
kj_58707,6,pd tt ld le me lf
kj_54412,14,pd qc pc qd qf rf qg rg qh qe pe rh qi tt
kj_38938,13,pc pe qe qf qd pf nd lc mc ld nf pd qc
kj_91192,6,pc tt pf tt qi qk
kj_75946,31,pd qc pc qd qf rf rg qe pf pe oe od ob nd ne me mf mc qb re qh rb ra rc le md mb lb nb kc kf
kj_82018,7,pc qe tt od oc nd mc
kj_57496,6,pd nc lc tt id tt
kj_65627,10,pd nc tt pf of og nf ng mf pi
kj_77129,7,pd tt kc kd tt kb lc
kj_84474,16,pd qc pc qd qf qe pe rf qb qg pf rh rc rd sd re
kj_53660,9,pd nc oc nd pf jd tt qh hc
kj_60489,6,pd nc oc nd tt pe
kj_91595,23,pd qc pc qd qf qe pe rf tt qg pf qb tt pg og oh ng nh mh mg ne tt lh
kj_48164,8,pc qe od qh pf qf pg nc
kj_97951,6,pc tt qe pf tt qf
kj_67137,14,pc qe qg od pd pe oe of ne pg ph oh pi oi
kj_80700,6,pd tt oc nd nc ld
kj_88231,16,pd qc pc qd qe re rf qf pe rg rd sf rc tt og pi
kj_32692,10,pc qe tt od oc nd mc qh ph pg
kj_31421,15,pc tt pe pf of qe oe qd pg qf qc qg ph qi tt
kj_76100,7,pd tt nc md mc kd hd
kj_61748,7,pd nc qf ne pb pg pf
kj_80321,6,pd nc lc tt id pf
kj_87306,26,pd qc pc qd qf qe pe rf qb rb re pb rc qa rd qb rg pf qg nc nf tt lc ld kd md
kj_98525,10,pc pe qe qf qd pf nc pj pl ql
kj_91261,9,pc tt qe oc od nc pb nd oe
kj_89743,6,pc qe od pg qd tt
kj_62198,14,pc qe tt od oc nd mc tt md me le lf mf ne
kj_90367,11,pc qe qg od pd pe oe of ne pg md
kj_20522,6,pd tt nc lc kd ld
kj_40721,6,pc tt qe oc pd ld
kj_51090,13,pd qc pc qd qf qe pe rf tt qg pf qb mc
kj_78426,11,pc qe tt od oc nd mb tt pg of og
kj_84201,17,pd nc qf pc qc qb oc pb ob od nb qd pe rd mc tt qh
kj_90151,8,pd tt nc qf tt rd qc of
kj_31659,8,pc qe qd pe nc qi qk tt
kj_45703,21,pc tt pe pf of qe oe qd pg pd od qc qf oc nc pb tt nb tt qh rg
kj_72328,16,pc qe tt od qd rd rc pd qc oc re rf sd pf qg qf
kj_09654,9,pc pe tt qc tt pb oc ob qd
kj_37281,7,pd nc lc me ke pf of
kj_86753,21,pd nc tt qf pf pg of qd qc qe nd pe od rc pb qb pc lc rb sb qa
kj_57673,7,pc qe ph od oc nd mb
kj_57392,14,pd qc pc qd pe rf tt qg pg ph qf rh oh pi
kj_26753,14,pc pe qe qf qd pf nd lc mb pj tt pd qc tt
kj_11011,8,pc tt pe pf qe pj tt nf
kj_88294,8,pd nc qf tt oc nd tt qh
kj_20585,16,pd qc pc qd qf qe pe rf tt qg pf qb tt ld oh mg
kj_86922,6,pd nc lc ld kd le
kj_01892,17,pd qc pc qd pe rf tt qg tt nc qb ob pb ne qf qh nf
kj_58895,9,pc qe od qh tt lc tt nc tt
kj_61078,8,pc tt pe qg pg ph og rf
kj_13458,18,pd qc pc qd pe qf pf qg qe re rf rd qh rg pg rh tt kc
kj_83672,7,pd tt nc qf tt mc md
kj_41188,17,pd qc pc qd qf rf qg rg qh tt rh pb ob qb nc qe pe
kj_95744,7,pc qe nd lc qg le og
kj_15138,13,pc qe qh od pd pe oe nd of rc nb pg me
kj_94334,11,pc qe tt od oc nd mc tt md tt qg
kj_89166,9,pc pe qe qf qd pf nc tt qj
kj_26037,6,pc tt pe mc kc kd
kj_91656,12,pd nc tt qf pf pg of qd qg qe ph pc
kj_93978,7,pc tt qf tt lc tt ke
kj_47579,6,pd tt mc tt qe tt
kj_53303,6,pc pe qe qf qd pg
kj_64684,12,pc qe nd tt qi qc qb pd oc rc qg rb
kj_51169,9,pd tt nc md tt mc nd me id
kj_75722,7,pd tt nc md nd mf tt
kj_85254,6,pc tt qe pf pe nf
kj_34908,13,pd qc pc qd pe rf tt qg tt lc ic le ng
kj_51137,12,pd nc lc qf nd qc qd pc od nb rd rc
kj_59307,7,pd nc tt kc oc nd pf
kj_68329,18,pd qc pc qd pe rf qb rb re qe qf pb rc qa rd qb qg nc
kj_73028,12,pc pe qe qf qd pf nc pj tt qm pm ql
kj_48504,8,pd nc oc nd pf tt kc hc
kj_20711,7,pc tt pf tt qh qc qd
kj_69678,13,pd qc pc qd pe rf qg tt pb rg qh qb ql
kj_85909,13,pd qc pc qd qf rf qg qe pe rg qh pk tt
kj_36051,7,pc qe qd pe nd pi of
kj_85569,6,pc tt pe pi tt qg
kj_37936,24,pd qc pc qd qf qe pe rf tt ld qg rg qh of qb rb rc pb re qa rd qb rh nc
kj_84205,18,pd qc pc qd qe re rf qf pe rg rd sf rc qb rb pb ob nb
kj_49661,8,pc tt pe qi tt qg tt re
kj_61476,12,pc tt pe pf of qe oe qd pg pd od qc
kj_53083,8,pc qe qh od oc nd mb oh
kj_52936,7,pd tt nc qf rd tt qj
kj_55775,7,pd nc oc nd pf tt kc
kj_50956,8,pd tt nc re qf rf qd qh
kj_79258,6,pc tt pf qh qj tt
kj_14601,6,pc tt qf qh og tt
kj_63717,15,pd qc pc qd qe re rf qf pe rg rd sf rc pf qi
kj_39273,7,pc qe qh ne qd pe nc
kj_55343,6,pc qe qd pe nc pi
kj_77712,18,pd qc pc qd qe re rf qf pe rg rd sf rc tt og qj qh rh
kj_60009,8,pd qc pc qd qf rf pe rg
kj_81731,22,pc qe tt nd pe pd od qd oc oe pf qc nc md of ne mc ld lc kd qf kc
kj_59353,9,pc pe qe qf qd pf nc od oc
kj_47263,8,pd tt nc od tt oc pc pb
kj_74886,12,pd tt nc md tt nd mc lc od kd le ld
kj_02408,11,pc qe qd pe nc pi qk tt oj qj rk
kj_73487,8,pd tt nc tt qi md nd mf
kj_11397,7,pc tt pe tt ph lc kc
kj_92905,15,pd qc pc qd qf rf rg qe pf pe oe od pb nd ne
kj_57011,14,pd nc jc qf pf pg of qc qe pc qg qj qh tt
kj_40475,7,pd tt nc qc qd rd re
kj_92114,15,pc tt pe oc od nc pb nd ne me nf mf mg ng mh
kj_54841,11,pc tt pf qh tt pd od qd qc rc nc
kj_39209,7,pd nc tt qf oc nd re
kj_81898,6,pd tt nc tt qh tt
kj_61261,13,pd qc pc qd qf qe pe rf tt qg pf qb kd
kj_90409,11,pc tt qf pd oc qc qd qe rd re rc
kj_41598,9,pc qe qd pe nc tt qi tt me
kj_74451,6,pc qe od qh tt oh
kj_92555,9,pc pe qe qf qd pf nc qj tt
kj_23612,7,pd nc oc nd pf tt kb
kj_10259,14,pc tt pe oc od nc md pb qc nd ne mc me kc
kj_13087,12,pd qc pc qd pe rf tt qg tt ld lf id
kj_90589,7,pd tt nc qf tt qi tt
kj_84858,12,pd nc lc qc pc qd pe pb ob qb nb qf
kj_29154,9,pd pc qc oc qd lc od tt kb
kj_52931,9,pc pe qe qf qd pg of og rf
kj_48365,8,pc qe nd lc hc tt jc le
kj_64493,16,pd qc pc qd qf qe pe rf qg rg qh tt qb rb tt of
kj_28419,7,pd tt nc md mc kd jg
kj_67105,6,pc tt qf pg pf ng
kj_33552,13,pd nc qf pc qc qb oc pb od ob nd mc qj
kj_55701,10,pc tt qf nc tt qc pd pb ob qb
kj_65047,8,pd nc pf oe pe pb qi tt
kj_88783,12,pd nc qf pc qc qb oc pb od ob rc nd
kj_64121,10,pd nc lc qf nd qc qd pc od oc
kj_57097,10,pd qc pc qd pe rf tt mc me qb
kj_55217,6,pc qe od qh tt ql
kj_80390,17,pc qe qh od pd pe oe nd of rd rf ob pb oc rb rc oa
kj_69791,10,pd tt nc tt qi qf oi qd qc rc
kj_81137,7,pd nc oc nd pf qh qk
kj_87693,11,pc qe nd tt qi tt qd tt oi rd rc
kj_81342,8,pd tt nc md nd mf tt pg
kj_54245,7,pd nc lc tt pg tt qc
kj_28210,6,pc tt qe pf qf tt
kj_88783,12,pd nc qf pc qc qb oc pb od ob rc nd
kj_69977,7,pd nc oc nd pf qh lc
kj_65494,6,pd tt nc re rd qd
kj_73133,10,pd qc pc qd pe rf tt kd tt qg
kj_63049,9,pc pe qe qf qd pf nd pj tt
kj_38180,10,pc qe od lc qi rc pf qf pg rh
kj_32845,9,pc qe qd pe nc tt qi mf ne
kj_80403,13,pd qc pc qd qf qe pe rf qg rg qh of pf
kj_66718,11,pd nc lc tt nd qc qd pc od nb tt
kj_56876,8,pd qc pc qd pe qe qf rf
kj_99704,8,pd qc pc qd pe rf mc lc
kj_77303,11,pd qc pc qd pe rf tt lc ic le je
kj_83508,8,pd kc tt nc oc nd pf tt
kj_81155,6,pd qc pc qd pe rf
kj_82528,12,pd qc pc qd pe rf tt md qf rg qb rb
kj_88783,12,pd nc qf pc qc qb oc pb od ob rc nd
kj_94712,7,pd nc pf oe pe pb pi
kj_67157,10,pc qe qg od pd pe oe of ne pg
kj_64478,9,pd pc qc oc qd lc tt ne tt
kj_40497,9,pc qe tt mc nd md ne me qd
kj_95660,7,pc qe od tt qh tt oh
kj_85254,6,pc tt qe pf pe nf
kj_14655,9,pd nc lc ne pg jc le je hc
kj_17644,7,pd nc qf tt jc tt je
kj_95225,22,pd qc pc qd qf qe pe rf tt qg pf qb tt pg og oh ng nh mh mg ne lg
kj_74297,13,pc pe qe qf qd pf nc pj tt qm rh pd qc
kj_32523,11,pc pe nc od oc qd qc rc re rd rg
kj_60549,15,pd nc qf pc qc qb oc pb od ob nd mc tt le tt
kj_91230,10,pd nc lc jc tt ne pg je pb tt
kj_57793,10,pd qc pc qd pe rf tt mc le qb
kj_95225,22,pd qc pc qd qf qe pe rf tt qg pf qb tt pg og oh ng nh mh mg ne lg
kj_74297,13,pc pe qe qf qd pf nc pj tt qm rh pd qc
kj_32523,11,pc pe nc od oc qd qc rc re rd rg
kj_60549,15,pd nc qf pc qc qb oc pb od ob nd mc tt le tt
kj_91230,10,pd nc lc jc tt ne pg je pb tt
kj_57793,10,pd qc pc qd pe rf tt mc le qb
kj_78531,19,pd qc pc qd qf qe pe rf qb rb re pf qg rd rg pb ob qa oh
kj_36172,7,pc qe od tt qh pk oh
kj_46306,6,pc qe nd pi tt kd
kj_98368,10,pd qc pc qd qf rf qg rg qh tt
kj_57554,6,pc qe od kc tt qh
kj_76682,11,pc pe qe qf qd pf nc pj tt qm tt
kj_77379,8,pc tt qe oc od nd nc ob
kj_75530,6,pd tt nc qf qe pf
kj_61407,14,pd qc pc qd pe qf tt rg pf pg og ph tt mg
kj_81954,9,pc qe tt od oc nd mc tt md
kj_51911,13,pd qc pc qd qf qe pe rf tt qg pf qb pb
kj_47844,9,pc qe qd pe nc pi tt lc tt
kj_31421,15,pc tt pe pf of qe oe qd pg qf qc qg ph qi tt
kj_50853,9,pd qc pc qd qf qe pe rf kc
kj_84823,6,pc qe od pg tt lc
kj_50130,6,pc tt pe qg qf pg
kj_29696,22,pd nc qf pc qc qb oc pb nd ob od mc md ld lc lb kc kb jc le je lg
kj_67890,11,pd qc pc qd pe rf tt ld qf rg jc
kj_52436,8,pc tt pf qh tt pd qc tt
kj_02485,11,pd qc pc qd pe rf tt kd tt qg mc
kj_44474,9,pd tt nc tt pi md tt qg qe
kj_43121,8,pc tt qe pf pe nf tt pj
kj_09878,19,pd qc pc qd pe rf tt lc qb rb re qe qf pf qg rd rg of ob
kj_72383,12,pd nc tt qf pf pg of qc qe pc qg tt
kj_52118,8,pd qc pc qd pe rf ld tt
kj_27212,15,pc qe tt nd pe pd od qd oc oe pf qc nc of pg
kj_55406,15,pd qc pc qd pe rf qb rb re qe qf rd rg se qg
kj_03846,10,pd nc qf pg oc nd pf ng nf mf
kj_88463,10,pc pe qe qf qd pf nc tt pj pl
kj_67862,8,pd qc pc qd qf qe pe rf
kj_30318,16,pd nc qf pc qc qb oc pb od ob nd mc tt le tt ph
kj_70708,10,pd nc nd od oc oe pc md nb ne
kj_37373,6,pd tt nd tt kc kd
kj_11013,8,pc qe od tt qh pf rd pk
kj_73701,8,pd qc pc qd pe rf tt qb
kj_52095,6,pc tt qf nc tt kd
kj_47235,16,pd qc pc qd qf qe pe rf tt kc tt ke qg rg qh of
kj_55566,15,pd nc tt qf pf pg of qd qc qe pc kd ic md ie
kj_51414,13,pd qc pc qd qf qe pe rf qg rg qh ld lf
kj_05343,13,pc tt pf qh tt pd od qc ob oe pe qd qb
kj_59289,10,pc pe qe qf qd pf nc od oc tt
kj_23682,8,pc qe qd pe nc tt qh oh
kj_00636,14,pc pe qe qf qd pg tt nd oe od pd pf nb le
kj_96483,12,pd qc pc qd qf qe pe rf tt qg pf qb
kj_24898,8,pd nc oc nd pf jd ie id
kj_83425,7,pd tt nc qf qh of oh
kj_85668,14,pd qc pc qd pe rf tt qg pg ph oh oi og ni
kj_35158,12,pc qe nd pi tt lc tt pd oc qc qb rc
kj_87052,11,pd nc qf pc qc qb rb pb qd kd ic
kj_19567,6,pc tt pf tt qi kc
kj_92386,21,pd qc pc qd qf rf rg qe pf pe oe od pb nd of qb nb nc mb ob me
kj_82100,9,pc qe od qh qj tt oj tt qd
kj_51788,8,pd tt nc qf qe pf qj me
kj_53996,6,pd nc oc nd pf jd
kj_47942,7,pd tt nc md mc tt kf
kj_73909,6,pd nc qf ne oc nb
kj_68199,21,pc tt qf pd qd oc pe od pb oe of nf og ng oh qc ob mc rc tt kd
kj_22225,11,pd qc pc qd pe rf qg mc pb rg qh
kj_79255,18,pd qc pc qd qf qe pe rf qb rb re pf qg rd rg of ld oh
kj_92289,7,pc qe qg od oc nd mb
kj_67297,6,pc qe od tt qi tt
kj_54754,16,pd qc pc qd qf qe pe rf qb rb re rd rg se qg of
kj_22098,14,pd qc pc qd qf qe pe rf tt qg pf tt rg rh
kj_38439,13,pd nc qf tt kc pc qc qb rc od pb ob oc
kj_21161,17,pc qe tt od qd rd pe pd qc rf qf re oc pf mc nd tt
kj_37579,15,pc qe tt od oc nd mc tt md tt qg me le mf of
kj_03829,14,pd qc pc qd pe qf tt rg tt ld og mg tt ni
kj_40199,6,pd nc oc nd qf kd
kj_81155,6,pd qc pc qd pe rf
kj_12774,15,pd tt nc qf qi qk oi qd qc rc rb pc qb pe od
kj_12355,8,pd tt nc qf qi qk oi tt
kj_03832,8,pc qe nd tt qh tt kc ie
kj_96113,6,pc qe nd tt kc ie
kj_02005,13,pd nc lc jc tt qc pc qd pe pb ob qb hc
kj_97687,10,pd qc pc qd pe rf tt lc ke me
kj_99426,8,pd nc oc nd pf qc ob re
kj_72212,6,pd tt nc qf tt of
kj_61161,18,pc tt qf pd od qc qd pe qe oc pb nd oe pf nc qg rc pg
kj_53210,15,pc qe tt od oc nd mc tt md tt qg nf og me qd
kj_85079,9,pc qe od tt pf tt qg tt qj
kj_58701,13,pd nc qf pc qc qb rc od pb ob oc tt pc
kj_35035,11,pc pe qe qf qd pf nc pj tt qm oh
kj_25556,6,pc qe qd pe nc jc
kj_18663,9,pd tt nc qf qe pf qh mf ld
kj_88018,6,pd tt nc tt qg lc
kj_81109,6,pd nc lc ne pb kd
kj_43741,10,pc pe qe qf qd pf nc tt qj ql
kj_81692,6,pc pd qc tt od tt
kj_98588,8,pd nc pf oe pe pb tt qc
kj_64799,7,pd nc pf tt oc tt pj
kj_76319,6,pd nc pf tt jc tt
kj_92839,16,pd qc pc qd qf qe pe rf qb rb re rd rg pf qg of
kj_71881,11,pc pe qe qf qd pf tt nd tt ob pb
kj_98727,9,pc qe tt od oc nd mc le tt
kj_33764,7,pc qe od tt pf qg pj
kj_42865,17,pd tt nc qf tt qd qc rc qe rd pe re pf qg tt pg tt
kj_91564,14,pd qc pc qd pe qe qf rf tt qg pf qb tt lc
kj_48748,8,pc pe qe qf qd pg md tt
kj_15139,7,pd tt nc qf tt kc rd
kj_38864,16,pd qc pc qd qf qe pe rf tt qg pf qb tt md lf kd
kj_79952,15,pd nc tt qf nd md ne oc pc pg qe re pf rf ng
kj_79405,12,pc pe qe qf qd pf nc pj tt od oc tt
kj_20702,8,pd nc lc id nd od oe oc
kj_40721,6,pc tt qe oc pd ld
kj_10676,15,pd qc pc qd qe re rf pb ob oc pe nb qb oa rc
kj_64823,12,pd qc pc qd pe rf tt qg tt ld lc md
kj_71696,8,pd qc pc qd pe rf tt qg
kj_93759,7,pc tt pe tt lc qd qe
kj_88412,8,pc tt pe qi tt qg qf pg
kj_81743,6,pd nc qf pe tt qe
kj_64965,19,pd qc pc qd qf qe pe rf qb rb rg pf qg pb of tt ob qa tt
kj_60301,16,pd qc pc qd qf qe pe rf tt qg pf qb tt pg ld tt
kj_18309,8,pd pc qc oc qb lc od nc
kj_51672,10,pc pe qe qf qd pf nc tt mf pi
