定式ID,匹配步数,落子前缀
kj_94621,9,pc qe od qh qj tt qd pe tt
kj_64296,8,pd tt nc qf qi rd qc pe
kj_92403,19,pd qc pc qd qf qe pe rf qb rb rg pf qg pb re rd ob qa nd
kj_11013,8,pc qe od tt qh pf rd pk
kj_92647,8,pc pe qe qf qd pf nc qj
kj_03729,15,pc qe tt nd od oe nc md mc ld pe pf pd pg kb
kj_29929,6,pc qe nd lc jc jd
kj_90066,25,pc qe tt nd pe pd od qd oc oe pf qc nc ne lc rg ph le mh kc kb ld mb jc jb
kj_67235,15,pd nc tt qf pf pg of qd qc qe nd pe od lc pb
kj_67157,10,pc qe qg od pd pe oe of ne pg
kj_96483,12,pd qc pc qd qf qe pe rf tt qg pf qb
kj_88783,12,pd nc qf pc qc qb oc pb od ob rc nd
kj_52939,9,pc qe tt od oc nd mc tt qg
kj_61184,20,pc tt pe pf qf qg pg of og qe rf nf re qd pd rg rd ng oi qj
kj_46815,10,pd qc pc qd pe rf tt qg mc md
kj_56664,9,pc qe od tt qh pf qk rc tt
kj_96514,8,pc qe nd tt qi ph qh pg
kj_85096,13,pc qe tt od oc nd mc tt md tt mf tt pg
kj_69929,11,pc qe tt od oc nd mc tt qg og pi
kj_29685,7,pc qe tt mc od jd tt
kj_98850,6,pc qe nd tt jd hd
kj_93711,13,pd nc tt qf nd md ne pc qc oc qd qi tt
kj_59105,13,pc qe tt od oc nd mc md lc ld kd ke je
kj_45346,21,pd qc pc qd qf qe pe rf qb rb rg pf qg pb of tt mh tt ob qa tt
kj_48972,10,pc qe nd tt pf qc qb qd ob qg
kj_75834,6,pd tt nc qf tt pi
kj_71013,6,pc qe nd ph tt lc
kj_63272,18,pd qc pc qd pe qe qf rf tt pf qg rg qh of oh nh qb rb
kj_53085,7,pc qe qh od oc nd mb
kj_10931,9,pd nc qf tt oc nd jc nf ph
kj_93684,7,pc qe nd tt qg qi og
kj_96907,6,pc qe od qh qd pe
kj_53855,7,pd nc qf tt lc tt le
kj_54212,27,pd qc pc qd qf qe pe rf qb rb re pb rc qa rd qb rg pf qg nc nf ld tt of og oe pg
kj_21957,25,pc pe qe qf qd pf nc pj pl ql rh pd qc qh qi pi qg ph rf pg rg tt pk qj qk
kj_89737,9,pc tt pf tt ld qd pd lc tt
kj_84215,15,pd qc pc qd pe rf tt qg pg ph oh oi nh pf og
kj_55956,10,pd qc pc qd pe rf tt qg qe re
kj_82385,8,pd nc tt qc qd pc od rc
kj_28866,7,pc qe qd od pe pd qf
kj_55143,12,pd nc qf pc qc qb oc pb od ob me tt
kj_70878,12,pd qc pc qd qf rf qg rg qh qe pe kd
kj_75596,8,pd nc pf oe pe pb pi oi
kj_87638,9,pd nc qf tt oc nd jc hc lc
kj_82026,7,pd qc pc qd pe rf lc
kj_81155,6,pd qc pc qd pe rf
kj_57260,13,pd qc pc qd qf qe pe rf tt qg pf qb oh
kj_81707,7,pc qe od tt qi tt pf
kj_31951,7,pd tt nc tt qg tt kd
kj_08929,6,pc qe od ph tt rc
kj_64616,10,pd qc pc qd pe rf tt kd qf rg
kj_41971,8,pd tt nc tt qh qf oh of
kj_16538,6,pc tt qf nc tt lc
kj_81114,6,pc qe nd qi tt lc
kj_76511,15,pd qc pc qd qf qe pe rf qg rg qh of ld le md
kj_80818,8,pc qe nd tt qi tt pk tt
kj_86638,7,pc tt pf qh qk tt pi
kj_45651,7,pd nc lc tt qg tt ic
kj_34375,15,pc tt qf pd qd oc pe od pb qc ob mc rc tt kd
kj_84610,12,pc qe tt od oc nd mc md lc ld kc tt
kj_87261,10,pc qe nd lc tt qc qb rc pd pf
kj_07752,18,pd qc pc qd qf qe pe rf tt pf qg rg qh of qb rb oh ng
kj_98280,15,pd qc pc qd qf rf qg rg qh tt rh pb ob qb pe
kj_66606,10,pd tt mc ld md lf le ke me kh
kj_40212,13,pd qc pc qd pe rf tt qg tt ld qb rb tt
kj_52663,7,pc pe qe qf qd pg tt
kj_96526,10,pc tt pe pf qe oc od nc pb tt
kj_28527,8,pc qe qd pe nd ph tt ld
kj_56848,7,pd qc pc qd pe rf kh
kj_50679,6,pc tt qf tt pi pe
kj_71696,8,pd qc pc qd pe rf tt qg
kj_80391,6,pc tt qf nc tt ne
kj_88027,16,pd qc pc qd qf qe pe rf tt qg pf qb tt ld jc mg
kj_62125,7,pc tt pe pf of pg qe
kj_72797,7,pd qc pc qd pe rf rj
kj_72318,6,pc tt qe tt kd pf
kj_95308,8,pc qe ph od pd pe oe oc
kj_15508,9,pd qc pc qd pe rf tt oi pi
kj_84077,7,pc pe qe qf qd pg pk
kj_43732,17,pc qe qh od pd pe oe nd of rc nb pg pf qf qg ph ng
kj_83089,6,pd tt mc md nd me
kj_91838,6,pc pe ph qc qb qd
kj_98642,9,pd qc pc qd pe rf kd ke le
kj_50718,6,pc tt pf kc mc qd
kj_23674,30,pc tt qf pd od qc qd pe qe oc pb nd oe pf pg of ne qg rg qh me og rh qi qb mg tt rc rb kc
kj_89633,13,pd nc lc qc pc qd pe pb ob qb nb qf ic
kj_67986,7,pd tt mc ld md le kb
kj_84846,13,pd nc lc qc pc qd pe pb ob qb nb qf tt
kj_61228,8,pc qe od qh tt mc qd pe
kj_55177,7,pd nc lc tt qc oe pf
kj_88915,8,pd qc pc qd pe rf qg kd
kj_45259,7,pd tt nc md id mc nd
kj_97310,7,pc qe od tt qh qj oh
kj_68553,6,pd tt nc pi tt qf
kj_99044,6,pc qe nd tt jd jc
kj_67481,11,pd qc pc qd qf qe pe rf qg rg qh
kj_89703,9,pd nc kc oe od nd ne me nf
kj_04069,7,pd tt mc ne ld qh qe
kj_48482,6,pd tt nc md tt jd
kj_57968,9,pd qc pc qd pe rf ld le md
kj_11013,8,pc qe od tt qh pf rd pk
kj_21863,7,pc qe od qh ql tt qi
kj_97754,15,pc qe od tt pf qc qb rb qd rc pe pb ob qa tt
kj_72881,11,pc qe qi od oc nd nc md lc qk qg
kj_45836,11,pd nc qf pc qc qb rd ob od rc qd
kj_69508,10,pd qc pc qd pe rf tt qg mc tt
kj_50665,31,pd qc pc qd qf rf rg qe pf pe oe od ob nd ne me of qb md nc mc nb mb na le mf lf mg kh qh oh
kj_86762,8,pd qc pc qd pe rf tt ke
kj_85174,7,pc pe qe qf qd pf nd
kj_54628,6,pc qe nd tt kd tt
kj_86280,21,pd nc tt pf of og nf qc pc qd pe qe qb rb ob qa pa pb pg qf qb
kj_63377,12,pd qc pc qd qf qe pe rf tt ld qb rb
kj_42841,8,pd nc lc ld kd md ob ke
kj_37395,12,pd qc pc qd pe qf qb pf qj nf tt ql
kj_55989,9,pc tt qi pd qd oc pe od qc
kj_23835,8,pc tt qf md tt pd od qc
kj_81155,6,pd qc pc qd pe rf
kj_71505,24,pd qc pc qd qf qe pe rf qb rb re pb rc qa rd qb rg pf qg oe of pg nd nc
kj_61474,8,pc pe qe qf qd pf nc pj
kj_59211,6,pd tt kc ld mc ne
kj_96091,11,pd nc qf pc qc qb rc od pb oc rb
kj_75722,7,pd tt nc md nd mf tt
kj_42817,7,pc qe nd pi qh ph qi
kj_16538,6,pc tt qf nc tt lc
kj_81602,15,pd qc pc qd qe re rf qf pe rg rd sf rc tt og
kj_82577,10,pd nc qf pc qc qb rb pb qd kc
kj_58395,10,pc pe qe qf qd pf nc pj tt mk
kj_89853,19,pd qc pc qd pe rf qb rb re qe qf pb rc qa rd qb rg pf qg
kj_89929,10,pd qc pc qd qf rf pe rg tt ld
kj_71881,11,pc pe qe qf qd pf tt nd tt ob pb
kj_19719,8,pd tt nc re qf rf rc qh
kj_60414,7,pc qe qd pe nc tt pi
kj_79879,6,pc tt qf tt mc qh
kj_97530,18,pd qc pc qd pe qf pf qg qe re rf rd qh rg pg rh tt ld
kj_71223,8,pd qc pc qd pe rf lc kc
kj_92386,21,pd qc pc qd qf rf rg qe pf pe oe od pb nd of qb nb nc mb ob me
kj_55199,7,pd nc lc ne pf kd oc
kj_66256,6,pd tt nc tt qf pg
kj_50298,18,pd qc pc qd pe qf pf qg qe re rf rd qh rg pg rh tt qi
kj_38527,16,pd nc tt qf pf pg of qe qd og nd md oc ne od ng
kj_34676,10,pd qc pc qd pe qf pf qe qg rg
kj_97451,6,pd nc pf ne oc nb
kj_37667,12,pc qe tt od oc nd nc md mc ld tt qi
kj_79592,9,pc qe od tt qh pf oh nf ld
kj_27047,9,pc pe qe qf qd pf nd pj pl
kj_19417,7,pc qe ph od oc nd mc
kj_84418,8,pc pd qd oc qc od pf kd
kj_44682,7,pc tt pe oc tt pb qb
kj_25283,6,pc qe tt md od qh
kj_38074,6,pc tt pe qh pi ph
kj_95453,8,pd tt nc qf qe pf qh oh
kj_44162,7,pc tt qe pf pe nf pi
kj_55343,6,pc qe qd pe nc pi
kj_15654,17,pd qc pc qd pe rf tt kd qf rg tt ph lc kc ld ke le
kj_46496,11,pc tt pe qg tt oc od nc pb nd pg
kj_89298,9,pc qe tt mc od me pf qf ph
kj_56508,13,pc qe pg tt pe qd pd qg qh qf ph qc tt
kj_40619,10,pd pc qc oc qd lc tt ne pg tt
kj_38104,8,pc tt pf tt lc tt ke tt
kj_25638,8,pc tt pe qg qi pi pj ph
kj_80490,15,pc tt pf qh tt pd qd qe pe od qc qf pg ph nf
kj_86358,15,pd qc pc qd pe qe pf qf qg pg qh qb ld og pi
kj_67481,11,pd qc pc qd qf qe pe rf qg rg qh
kj_57420,11,pc pe qe qf qd pf nc pj tt pd qc
kj_02405,10,pd nc qf tt qi pc qc qb oc pb
kj_30190,8,pc qe qd pe nc tt pi tt
kj_63957,7,pc tt pe pf qe qf tt
kj_73064,7,pc tt pf kd tt nc tt
kj_71099,19,pc tt qf pd qd oc pe od pb oe of nf og ng ob oh ne pg pf
kj_80796,12,pc qe tt od oc nd mc md lc tt ke tt
kj_79152,17,pd qc pc qd qf qe pe rf qg rg qh tt rh pb ob qb tt
kj_60304,14,pd qc pc qd qf qe pe rf qg rg qh of ng qb
kj_90348,13,pd qc pc qd qe re rf qf pe rg rd sf rc
kj_59705,8,pd nc oc nd pf jd qi tt
kj_60298,17,pd qc pc qd qf qe pe rf qb rb re rd rg se qg of ld
kj_82477,11,pc qe nd tt jd qc qb pb ob pd pa
kj_56622,7,pc pe qe qf qd pf nc
kj_57160,6,pd tt mc qd qc pe
kj_79766,15,pd nc qf pc qc qb oc pb od ob tt nd tt qh ne
kj_23502,13,pc qe tt od oc nd mc tt qi tt md tt qg
kj_62267,12,pd nc tt qf pf pg of qe qd og nd oc
kj_55351,7,pc qe od tt pf tt qg
kj_98626,22,pc qe tt od oc nd mc md lc ld kd ke je nc nb ob mb qc pb jd kc kf
kj_53756,13,pd qc pc qd qf qe pe rf qg rg qh rh qi
kj_33776,8,pc qe qd od oc nd re nc
kj_45846,14,pd qc pc qd pe qe qf pf qg pb ob qb nc oe
kj_96483,12,pd qc pc qd qf qe pe rf tt qg pf qb
kj_65478,8,pd qc pc qd pe rf tt qi
kj_15406,6,pd nc ld ne pf jd
kj_65893,13,pd qc pc qd qf qe pe rf tt kd qg rg qh
kj_86031,11,pc pe qe qf qd pf nc pj ql pd qc
kj_89923,6,pc tt qf qh pi ph
kj_31659,8,pc qe qd pe nc qi qk tt
kj_96995,8,pd qc pc qd pe rf tt lc
kj_03923,8,pd tt nc md nd mf id tt
kj_57870,6,pc tt qf tt kd mc
kj_01849,14,pc tt pe pf of qe oe qd pg qf qc qg ph qh
kj_22479,9,pd nc qf tt kc ic ke ie oc
kj_95209,9,pd qc pc qd pe rf tt qg qi
kj_32515,7,pc tt pe tt kc tt ke
kj_68903,21,pd qc pc qd qf qe pe rf rg qg pf rh qb sg rc rd sd re tt ob pb
kj_21637,8,pc tt pe tt qh qd qe ph
kj_64485,6,pd tt mc qf tt of
kj_69051,6,pc qe pg oe nd pj
kj_74505,14,pd nc tt qf pf pg of qe qd md oc ob nd nb
kj_85515,14,pd qc pc qd pe rf tt ld qf qe rg qg pf rh
kj_55527,10,pc pe qe qf qd pf nc pj pl nk
kj_81155,6,pd qc pc qd pe rf
kj_01029,24,pd qc pc qd qf rf rg qe pf pe oe od ob nd ne me re qb md mc ld nc mf kb
kj_65920,6,pd tt md tt id tt
kj_27578,17,pd nc qf pc qc qb oc pb ob od nb qd pe rd mc tt lf
kj_07438,15,pc tt pe kd tt oc od nc pb nd ne me nf mf mg
kj_61184,20,pc tt pe pf qf qg pg of og qe rf nf re qd pd rg rd ng oi qj
kj_25348,15,pd qc pc qd pe rf qb rb re pb qe qi ob qa sc
kj_64913,9,pd qc pc qd qf qe pe rf ld
kj_46620,10,pd nc tt pf of og nf ng nd mf
kj_25556,6,pc qe qd pe nc jc
kj_69077,37,pd qc pc qd qf qe pe rf qb rb re pb rc qa rd qb rg pf qg nc nf ld tt of oe ph nd me oh pg ne qi mc oc sf md oi
kj_50865,17,pd qc pc qd qf qe pe rf qb rb re rd rg pf qg of ob
kj_82750,12,pd qc pc qd pe rf tt qg tt ld lf nc
kj_32192,7,pc qe nd qi tt lc tt
kj_62036,18,pd qc pc qd pe qe qf rf rg qg pf rh qb sg rc rd sd re
kj_28687,13,pc pe qe qf qd pf nc pj pl ql qm qk tt
kj_52316,8,pc tt pf tt ld lc mc kc
kj_94192,7,pc tt qi pd oc qd qc
kj_72623,17,pd qc pc qd pe qf pf qg qe re rf rd qh rg pg rh tt
kj_57753,12,pd nc tt qf nd md ne oc pc qi qe pf
kj_26745,10,pd tt md qc qd pc nc rd re rc
kj_31422,14,pc tt pe pf of qe oe qd pg qf qc qg ph qi
kj_67922,14,pc qe tt od oc nd mc tt md me le mf lf mg
kj_55169,7,pc qe od qh qj ql tt
kj_78747,18,pc tt pe pf of qe oe qd pg pd od qc qf oc nc pb tt nb
kj_92879,7,pd nc qf tt kc ic ke
kj_61889,14,pd qc pc qd qf qe pe rf qg rg qh tt ke kf
kj_67521,7,pc qe nd tt qi tt qd
kj_99263,6,pc tt pe qg qi og
kj_90367,11,pc qe qg od pd pe oe of ne pg md
kj_86541,6,pc tt qf tt qj pf
kj_61036,12,pc pe qe qf qd pf nd pj tt lc mc ld
kj_50010,8,pc qe tt od oc nd nc md
kj_29688,6,pc qe tt mc od jd
kj_26258,21,pd qc pc qd pe rf qb rb re qe qf pf qg rd rg of ld kd le ke lf
kj_72479,18,pd qc pc qd pe qf pf qg qe re rf rd qh rg pg rh tt mc
kj_88488,12,pd nc jc qf pf pg of qc qe pc qg lc
kj_49722,8,pd pc oc qc ob qe pe qf
kj_82065,14,pc qe tt od oc nd mc tt md tt mf tt pg qg
kj_33001,10,pd nc qf ne pb pg pf og rh qi
kj_70709,10,pc tt pe oc od nc pb nd le of
kj_15154,9,pd tt nc qf qh tt qe pf oh
kj_44358,10,pd tt nc md mc kd ld le lc kf
kj_91379,8,pc qe qd pe nc pi qk tt
kj_27727,7,pc qe nd tt qi qk tt
kj_86040,8,pc qe nd pi tt lc qh ph
kj_66931,8,pd qc pc qd pe rf tt le
kj_55305,6,pc qe od lc tt rc
kj_70293,16,pd tt nc qf tt qd qc rc qe rd pe re qb pf rg rf
kj_51655,13,pd nc qf pc qc qb oc pb nd ob od mc tt
kj_51671,12,pd nc qf pc qc qb oc pb nd ob od mc
kj_02657,7,pc tt qf nc lc qc qd
kj_91682,7,pc qe nd pi tt lc le
kj_38023,11,pd nc qf ne tt pg pf og pb tt of
kj_29554,9,pc tt pf tt pi nc tt qc qd
kj_42023,7,pc tt qf tt lc le tt
kj_52183,6,pd nc qf tt kc hc
kj_72479,18,pd qc pc qd pe qf pf qg qe re rf rd qh rg pg rh tt mc
kj_74381,12,pd qc pc qd qf qe pe rf tt pf qg rg
kj_06810,12,pc qe tt od oc nd mc le qg nc nb qc
kj_46305,10,pc tt qf ng ph pe qe pd qd oc
kj_73391,7,pc pe qe qf re of pd
kj_91611,6,pc tt qf tt mc rf
kj_73701,8,pd qc pc qd pe rf tt qb
kj_82026,7,pd qc pc qd pe rf lc
kj_56203,17,pc pe qe qf qd pf tt oc ob nb od nc pd me lc pb qb
kj_69355,8,pc pd qd oc qc od pf kc
kj_56762,17,pd nc qf pc qc qb oc pb od ob nd mc md ld lc lb kc
kj_82018,7,pc qe tt od oc nd mc
kj_64380,11,pd qc pc qd pe qf qb pf qj nf qm
kj_39788,9,pc qe od tt qg pg qh pf oi
kj_80643,7,pd qc pc qd pe rf qg
kj_57786,7,pd nc qf tt lc tt ic
kj_53011,14,pd qc pc qd qf qe pe rf tt qg pf rh tt md
kj_18738,12,pd qc pc qd pe rf tt lc tt hc qb rb
kj_51687,10,pd nc tt pf of og nf pg nd qc
kj_96140,11,pc tt pe kd tt oc od nc pb nd tt
kj_85829,10,pc qe tt od oc nd mc tt ic tt
kj_52045,10,pc pe qe qf qd pf nc tt pj me
kj_97544,6,pd tt mc tt qf pg
kj_89131,18,pd qc pc qd qf qe pe rf qb qg pf rh rc rd sd re qi pg
kj_23582,7,pc qe od ph tt lc ic
kj_72064,7,pd pc qc oc qb kc tt
kj_39947,10,pc pe qe qf qd pf nc qj ql tt
kj_54817,7,pc qe qg od pd pe oe
kj_35410,18,pd tt nc qf tt qd qc rc qe rd pf re pe qg tt oh tt ld
kj_68646,8,pc tt pf qh tt kc tt nc
kj_68071,8,pc qe nd pi tt lc ph qi
kj_69692,7,pc qe qd pe nc pi me
kj_66212,14,pd qc pc qd pe qe qg tt qf pb ob qb nc of
kj_56622,7,pc pe qe qf qd pf nc
kj_16045,7,pd tt mc qf qh ne oc
kj_67353,10,pd qc pc qd qf qe pe rf tt ld
kj_91833,11,pc tt qf tt pi pe qe pd qd oc pb
kj_81240,10,pd qc pc qd pe rf tt nc qf qe
kj_51363,10,pd qc pc qd pe rf tt ld lf jc
kj_95660,7,pc qe od tt qh tt oh
kj_58578,13,pc pe qe qf qd pf tt oc ob nb od nc pd
kj_27833,12,pc pe qh qc qb qd ob pg ph oh oi qg
kj_58056,11,pd qc pc qd pe rf tt qg tt og tt
kj_89888,9,pd qc pc qd pe qf og rg tt
kj_33863,8,pd nc nd md ne ob qc qg
kj_32015,7,pc tt qi tt pe tt pi
kj_14374,8,pd nc qf tt kc tt pc pg
kj_59236,7,pc tt pe tt qh qd qc
kj_79417,15,pc tt pf qh tt pd od qc qd pe qe oe oc rb qg
kj_96483,12,pd qc pc qd qf qe pe rf tt qg pf qb
kj_07127,7,pc tt pe qh ph pg oh
kj_63543,6,pc tt qe oc od nc
kj_55795,9,pc pe qe qf qd pf nc tt pi
kj_65086,6,pd tt kc kd lc ld
kj_82222,9,pd tt nc qf qe pf pi mf md
kj_55991,9,pc pe qe qf qd pf nc tt ph
kj_96385,21,pd qc pc qd pe rf qb rb re qe qf pb rc qa rd qb rg pf qg nc nf
kj_50298,18,pd qc pc qd pe qf pf qg qe re rf rd qh rg pg rh tt qi
kj_10676,15,pd qc pc qd qe re rf pb ob oc pe nb qb oa rc
kj_03781,12,pc pd oc qd qc rc rb re sc tt ne sd
kj_77676,15,pc tt pe pf qf qg pg of og qe rf nf re ng oi
kj_57380,6,pc tt pf pd od qc
kj_96136,6,pc tt pf tt mc qh
kj_46005,13,pc tt pf qh qk pd od qd qc rc rb re sc
kj_15361,8,pd tt mc qf pf pg qe of
kj_35898,8,pd qc pc qd pe rf tt mi
kj_80643,7,pd qc pc qd pe rf qg
kj_83361,7,pc pe qe qf qd pg nd
kj_19167,18,pc qe tt od qd rd pe pd qc rf qf re oc nd mc md lc ld
kj_43617,8,pd tt nc qf qi tt qe pf
kj_18373,20,pc qe qh od pd pe oe oc ob md of pb qb qc pa qd pb mc rc rd
kj_37699,9,pc pe qe qf qd pf nc pj jc
kj_61474,8,pc pe qe qf qd pf nc pj
kj_24599,21,pc qe tt od oc nd mc md lc ld qd rd rc pd qc tt kd ke je kf jf
kj_63356,8,pc qe qd pe nc pi pj qi
kj_77827,7,pd tt nc tt kc kd lc
kj_89148,19,pd qc pc qd qf rf rg pe qe re pg pb ob qb nc oe nd ne me
kj_37194,13,pd qc pc qd pe rf qg qf pf pb ob qb nc
kj_42559,7,pc tt lc pd qd oc qc
kj_82018,7,pc qe tt od oc nd mc
kj_58836,6,pc tt qe tt kc kd
kj_77716,16,pd qc pc qd qe re rf qf pe rg rd sf rc tt og qj
kj_41260,8,qc pd pc od qd pf nc qe
kj_51097,10,pd tt nc qf qi qk oi qd qc rc
kj_78435,9,pd tt nc md nd mf tt qg qe
kj_25779,7,pc qe od pg qd pe md
kj_87801,12,pd qc pc qd pe qf qb pf tt nf tt qj
kj_75984,11,pd nc tt qf pf pg of qe qd kc jc
kj_58608,8,pd qc pc qd pe rf tt pf
kj_91920,13,pd tt mc qc qd pc oc ob nb od nc rd re
kj_54118,7,pc qe od tt qh pf qd
kj_64731,12,pc qe od tt qh tt pf qc qb rb qd rc
kj_97179,9,pc tt pf tt pi pd qd qc qe
kj_75639,9,pc tt pf qh tt oh tt pd qc
kj_36404,11,pc qe ph tt qd od pd pe oe rd rc
kj_31766,8,pd tt nc rd qg qc pc rf
kj_60298,17,pd qc pc qd qf qe pe rf qb rb re rd rg se qg of ld
kj_49268,16,pd qc pc qd qf rf qg rg qh qe pe tt rh pb ob qb
kj_00843,13,pc pd qd oc pe od qc oe pf of og ng nh
kj_62125,7,pc tt pe pf of pg qe
kj_52899,9,pd nc tt pf of pg og ph pe
kj_29226,9,pc qe qd pe nc tt qi me tt
kj_88910,8,pc tt qe pb oc ob qb nc
kj_68496,8,pc qe od tt qh pf tt rc
kj_58375,8,pd nc pf oe pe pb le lc
kj_39724,14,pd qc pc qd qf qe pe rf qg rg qh pk qb rb
kj_84858,12,pd nc lc qc pc qd pe pb ob qb nb qf
kj_81155,6,pd qc pc qd pe rf
kj_11255,6,pc pe qh md oh qc
kj_02791,17,pc qe tt od oc nd mc tt md me le mf lf mg lg lh mh
kj_81172,14,pc tt qf pd qd oc pe od pb qc ob mc rc jd
kj_16406,12,pd pc qc oc qd lc kc kb jb lb kd ne
kj_18449,12,pd nc qf tt lc ld kd ke kc md le kf
kj_32044,11,pd nc lc qf nd qc qd pc od oc rd
kj_28210,6,pc tt qe pf qf tt
kj_54414,13,pd qc pc qd qf rf qg rg qh qe pe rh qi
kj_46205,10,pc tt pe pf tt qe oe qd qc of
kj_29521,6,pd nc jc jd kd ic
kj_65425,19,pd qc pc qd qf qe pe rf qb rb re pf qg rd rg of qj tt ld
kj_64464,18,pd nc tt qf pf pg of qc qe pc qg tt mc mb lb md lc tt
kj_87569,18,pd qc pc qd pe rf qb rb re qe qf pf qg rd rg of ob qa
kj_89501,17,pd nc tt qc pc qd pe pb ob qb nb mc kc qf mb ic id
kj_69906,10,pc qe tt od oc nd mb tt ph nh
kj_89690,7,pc tt pf tt qi pi qh
kj_67961,7,pd nc oc nd pf qh kc
kj_62515,11,pc pe qh qc qb qd ob nc od pg ph
kj_81155,6,pd qc pc qd pe rf
kj_52373,28,pd qc pc qd qf rf rg qe pf pe oe od ob nd ne me of qb md nc mc nb mb na tt mf jd hc
kj_17639,9,pd tt nc re qf rf qd qe qh
kj_69977,7,pd nc oc nd pf qh lc
kj_70379,6,pc qe nd tt qg tt
kj_00023,16,pd nc qf pc qc qb oc pb ob od nb qd pe rd mc mf
kj_67481,11,pd qc pc qd qf qe pe rf qg rg qh
kj_53838,7,pc qe od qh kd tt qj
kj_70115,7,pd qc pc qd pe rf ld
kj_53452,7,pc qe nd pi tt oi tt
kj_86425,6,pc tt qi pe nc tt
kj_98460,20,pd qc pc qd qf qe pe rf tt qg pf pb ob qb nc pg og oh ng nh
kj_82228,18,pd qc pc qd qe re rf qf pe rg rd sf rc tt og pi tt ql
kj_05808,9,pd nc oc nd pf re qg qc nb
kj_91269,7,pc tt pe qi qg oi tt
kj_26981,17,pd qc pc qd pe rf tt kd tt qg pg ph qf rh oh pi tt
kj_20928,14,pc qe od qh pf qf pg ph oh oi nh ni mh mi
kj_06055,7,pc tt pe tt qi qd pd
kj_40721,6,pc tt qe oc pd ld
kj_72747,14,pc qe pg tt pe qf pf qd qg qc ob nc pd qb
kj_67137,14,pc qe qg od pd pe oe of ne pg ph oh pi oi
kj_92452,6,pc tt qf tt kd kc
kj_21272,6,pd tt nc qf re pc
kj_79946,19,pc tt qf pd qd oc pe od pb oe of nf og ng ob oh ne me nd
kj_99340,18,pc tt pe pf of qe oe qd pg pd od qc qf oc nc pb ob nb
kj_28811,8,pc qe ph od oc nd mb tt
kj_24457,14,pc tt pf qh qj oh qg rg rf od oc pg qf of
kj_71240,7,pc qe pg oe nd tt qj
kj_72797,7,pd qc pc qd pe rf rj
kj_79635,17,pd qc pc qd qf qe pe rf qb rb rg pf qg pb of tt ni
kj_81327,8,pc qe nd tt qi ne me mf
kj_27449,12,pc qe qh od oc nd mb oh pj tt ni tt
kj_85254,6,pc tt qe pf pe nf
kj_83164,6,pc qe od qh qj tt
kj_71407,15,pd tt nc qf tt qd qc rc qe rd pe re qb qh tt
kj_52911,12,pc qe tt od oc nd nc md tt mc rd re
kj_66621,7,pc qe tt od oc nd mb
kj_80317,6,pc tt pf mc tt qh
kj_06247,32,pd qc pc qd qf rf rg qe pf pe oe od ob nd ne me of qb md nc mc nb mb na le mf lf mg lg mh lh mi
kj_52196,7,pd nc tt oe qf pg qg
kj_81155,6,pd qc pc qd pe rf
kj_11639,13,pd qc pc qd pe rf qg qf pf pb ob qb tt
kj_61844,9,pc pe qe qf qd pf nc pj qm
kj_53996,6,pd nc oc nd pf jd
kj_82464,9,pc tt pf mc tt pd qc nd qd
kj_62223,7,pc qe od qh tt lc tt
kj_99067,6,pd tt nc md jc qf
kj_67519,9,pc pe qe qf qd pf nc qi pi
kj_76421,8,pc pe qe qf qd pg qh rf
kj_66713,6,pd nc pf oe pe pb
kj_04066,9,pc qe qd pe nc qi tt lc tt
kj_86788,9,pd qc pc qd pe rf lc tt qg
kj_69616,7,pc qe qd pe nc tt ph
kj_10269,12,pc pe qe qf qd pf nc tt ph mf ne nf
kj_11634,11,pc qe od tt qh pf rd nf og me lc
kj_36454,8,pd tt mc tt qe ld md lf
kj_11563,11,pd qc pc qd pe rf tt qg ld kd tt
kj_98588,8,pd nc pf oe pe pb tt qc
kj_71425,15,pc tt qf tt kc pd qd oc pe od pb oe of nf og
kj_94846,7,pd nc qf tt kc ic id
kj_12374,7,pc tt pf tt pi oi ph
kj_75498,17,pd qc pc qd pe qf pf qg qe re rf rd qh rg pg rh qi
kj_79986,10,pc pe qh md nc nd mc ld lc kd
kj_55297,8,pd nc oc nd pf jd hc tt
kj_33547,11,pc tt qf pd tt qc qd oc pb qe rd
kj_63441,10,pd qc pc qd pe rf tt ld jc kc
kj_66290,9,pc qe od qh tt lc qd pe nc
kj_82018,7,pc qe tt od oc nd mc
kj_96798,10,pc qe tt od oc nd mc tt qi oi
kj_51272,7,pd qc pc qd pe rf kd
kj_51905,6,pc qe nd tt qh pk
kj_74493,6,pd tt nc tt qf md
kj_32071,8,pd nc lc jc jd id kd ic
kj_47552,8,pc qe od qh kd tt kc tt
kj_13813,8,pd tt nc md nd re qe rd
kj_92722,11,pc qe tt od oc nd mc tt qd rd rc
kj_41023,10,pd nc nd md oc ne od nb me ld
kj_01738,25,pc tt pe pf qf qg pg of og qe rf nf re qd pd rg rd ng oi qj qm pl nh ql lh
kj_13500,15,pd nc lc qc pc qd pe pb ob qb nb qf tt jc jd
kj_12063,8,pd tt mc ld tt lc md me
kj_80551,6,pc tt qf tt pi tt
kj_81476,15,pc tt qf pd qd oc pe od pb qc ob mc rc jd tt
kj_38938,13,pc pe qe qf qd pf nd lc mc ld nf pd qc
kj_80246,9,pd nc tt qc pc qd qb rb ob
kj_42596,6,pd tt mc qi tt qf
kj_60232,18,pc qe od tt qh ql pf qc qb rb qd rc ob pe re oe pd ne
kj_28651,10,pc qe nd qh tt lc qd pe mc ld
kj_16419,8,pc tt pe pf qf qg qe qk
kj_59014,7,pd tt nc md nd qi qg
kj_18096,7,pd nc lc tt qc ld kc
kj_40965,7,pc qe qd pe nd tt pi
kj_58375,8,pd nc pf oe pe pb le lc
kj_49988,22,pd qc pc qd qf qe pe rf qb rb re pb rc qa rd qb rg pf qg nc tt of
kj_54665,17,pd qc pc qd pe rf qg tt rg qf pf pb ob qb sf re tt
kj_58515,13,pd qc pc qd qf qe pe rf qg rg qh tt le
kj_29637,8,pc tt pe qg qi og oi nf
kj_80327,7,pc qe nd tt qh lc pf
kj_78462,6,pc tt pf qh rf tt
kj_96869,9,pc qe pg oe nd ne md me ld
kj_16736,21,pc qe tt od oc nd mc md lc ld kd nc nb ob pb mb oa kc lb kb ma
kj_01265,13,pd nc qf pc qc qb oc pb od ob tt nd pi
kj_37402,10,pd qc pc qd pe qf tt rg ld og
kj_56714,6,pc qe od pg tt pk
kj_57260,13,pd qc pc qd qf qe pe rf tt qg pf qb oh
kj_93131,16,pd qc pc qd pe rf tt ld tt qg pg ph qf rh oh pi
kj_24039,15,pc qe nd lc jc le hd nb pe pf qd oe pd qf nc
kj_33552,13,pd nc qf pc qc qb oc pb od ob nd mc qj
kj_61589,17,pd nc qg qc pc qd pe pb ob qb oc rf oh tt rg qf pf
kj_51827,10,pc tt pe oc od nc nd pb qc lc
kj_58436,8,pd tt nc md nd tt qi mf
kj_22674,10,pc qe qd pe nc pi pk tt nk tt
kj_09927,11,pc qe tt od qd rd pe pd qc rf oc
kj_42757,8,pd tt nc qf qe pf qj ne
kj_20614,12,pc qe qg od pd pe oe of ne pg md pi
kj_52787,22,pd qc pc qd qf qe pe rf qb rb re pb rc qa rd qb rg pf qg oe tt of
kj_57954,8,pc qe qg tt pf qc qb rb
kj_81743,6,pd nc qf pe tt qe
kj_46059,20,pd nc kc qc pc qd pe pb ob qb oc qf hc nb na mf ng ma oa lc
kj_99019,14,pd qc pc qd pe rf tt qg tt lc qb rb ob qa
kj_60113,11,pd qc pc qd pe rf tt lc tt mf oh
kj_87808,8,pd nc lc jc tt ne pf pb
kj_67684,25,pc tt qf pd od qc qd pe qe oc pb nd oe pf nc qg rg of ob rh qh pg rf qi tt
kj_61379,9,pc pe qe qf qd pf nc pj ql
kj_83869,6,pc tt pe tt lc pf
kj_27578,17,pd nc qf pc qc qb oc pb ob od nb qd pe rd mc tt lf
kj_07438,15,pc tt pe kd tt oc od nc pb nd ne me nf mf mg
kj_25879,14,pd nc tt qf pf pg of qc qe pc qg qj qh tt
kj_56366,12,pd qc pc qd pe qf tt rg pf pg og ph
kj_97872,7,pd nc oc nd pf tt jd
kj_92193,12,pd qc pc qd pe rf tt ld oh qg pg pi
kj_07270,11,pd nc qf tt jc pc qc qb oc pb od
kj_94621,9,pc qe od qh qj tt qd pe tt
kj_64296,8,pd tt nc qf qi rd qc pe
kj_57260,13,pd qc pc qd qf qe pe rf tt qg pf qb oh
kj_93131,16,pd qc pc qd pe rf tt ld tt qg pg ph qf rh oh pi
kj_24039,15,pc qe nd lc jc le hd nb pe pf qd oe pd qf nc
kj_33552,13,pd nc qf pc qc qb oc pb od ob nd mc qj
kj_61589,17,pd nc qg qc pc qd pe pb ob qb oc rf oh tt rg qf pf
kj_51827,10,pc tt pe oc od nc nd pb qc lc
kj_58436,8,pd tt nc md nd tt qi mf
kj_22674,10,pc qe qd pe nc pi pk tt nk tt
kj_09927,11,pc qe tt od qd rd pe pd qc rf oc
kj_42757,8,pd tt nc qf qe pf qj ne
kj_20614,12,pc qe qg od pd pe oe of ne pg md pi
kj_52787,22,pd qc pc qd qf qe pe rf qb rb re pb rc qa rd qb rg pf qg oe tt of
kj_57954,8,pc qe qg tt pf qc qb rb
kj_81743,6,pd nc qf pe tt qe
kj_46059,20,pd nc kc qc pc qd pe pb ob qb oc qf hc nb na mf ng ma oa lc
kj_99019,14,pd qc pc qd pe rf tt qg tt lc qb rb ob qa
kj_60113,11,pd qc pc qd pe rf tt lc tt mf oh
kj_87808,8,pd nc lc jc tt ne pf pb
kj_67684,25,pc tt qf pd od qc qd pe qe oc pb nd oe pf nc qg rg of ob rh qh pg rf qi tt
kj_61379,9,pc pe qe qf qd pf nc pj ql
kj_83869,6,pc tt pe tt lc pf
kj_58488,27,pd qc pc qd qf qe pe rf qb rb re pb rc qa rd qb rg pf qg oe of pg ne nc od ph qi
kj_52388,7,pc qe nd pi tt qc qb
kj_74150,13,pd nc tt qf pf pg of qe qd tt pi og md
kj_93906,11,pc qe tt od oc nd nc md tt mc rc
kj_56084,9,pc qe tt od oc nd mb tt pg
kj_57908,25,pd qc pc qd qf rf rg qe pf pe oe od ob nd ne me of rb mc md lc kd jb pb oc
kj_12333,29,pc tt pe pf qf qg pg of og qe rf nf re qd pd rg rd ng oi qj nh mh mi lh li kh ki jh pk
kj_96483,12,pd qc pc qd qf qe pe rf tt qg pf qb
kj_84970,11,pd nc qf ne pb pg pf og of nf ng
kj_53303,6,pc pe qe qf qd pg
kj_33843,16,pd qc pc qd qe re rf qf pe rg rd sf rc pf tt lc
kj_84862,10,pd nc lc qc pc qd pe pb ob qb
kj_53303,6,pc pe qe qf qd pg
kj_63777,23,pd qc pc qd qf qe pe rf qb rb re pb rc qa rd qb rg pf qg nc nf ld tt
kj_80852,10,pc tt pf tt ld lc mc kc tt qd
kj_98525,10,pc pe qe qf qd pf nc pj pl ql
kj_33248,11,pd qc pc qd pe rf kc kd ld lc tt
kj_58538,8,pd qc pc qd pe rf tt ld
kj_90026,7,pc qe nd pi tt lc pf
kj_56249,28,pd nc qf pc qc qb oc pb ob od nb qd pe rd mc nd ld nf of md lc le ke lf kf lg oh kg
kj_11460,6,pc qe nd qh tt md
kj_91315,6,pc tt qf tt kc tt
kj_73229,8,pc pe qe qf qd pf nd tt
kj_98506,7,pd tt mc tt qf ld md
kj_80551,6,pc tt qf tt pi tt
kj_55343,6,pc qe qd pe nc pi
kj_92069,13,pd nc tt pf of og nf qc pc qd pe qe qb
kj_84002,12,pd qc pc qd pe rf tt ld qf qe qb rb
kj_60341,7,pc qe od qh pf qf oh
kj_28717,21,pc tt qf pd od qc qd pe qe oc pb nd oe pf nc qg rc of ne nf me
kj_41359,10,pc pe qh qc qb qd ob ne of oe
kj_25768,12,pc qe od ph tt lc of qg qd pe nc tt
kj_15698,11,pd nc qf pc qc qb rb pb qd ne md
